"No.,""Time"",""Source"",""Destination"",""Protocol"",""Length"",""Info""";;;;;;;;;;;;;;;;;;time 2;time 1;delay; delay2 ;delay 1;   jitter
"1,""0.000000"",""192.168.43.22"",""192.229.232.240"",""TCP"",""54"",""52748  >  80 [ACK] Seq=1 Ack=1 Win=515 Len=0""";;;;;;;;;;;;;;;;;;0.372877;0.372767;#VALUE!;#VALUE!;#VALUE!;#VALUE!
"2,""0.270775"",""192.229.232.240"",""192.168.43.22"",""HTTP"",""1414"",""Continuation""";;;;;;;;;;;;;;;;;;0.414759;0.372877;#VALUE!;#VALUE!;#VALUE!;#VALUE!
"3,""0.270863"",""192.168.43.22"",""192.229.232.240"",""TCP"",""74"",""52746  >  80 [ACK] Seq=1 Ack=1361 Win=515 Len=0 SLE=1 SRE=1361 SLE=5441 SRE=9521""";;;;;;;;;;;;;;;;;;0.414876;0.414759;#VALUE!;#VALUE!;#VALUE!;#VALUE!
"4,""0.288684"",""192.229.232.240"",""192.168.43.22"",""HTTP"",""1414"",""Continuation""";;;;;;;;;;;;;;;;;;0.415153;0.414876;#VALUE!;#VALUE!;#VALUE!;#VALUE!
"5,""0.288772"",""192.168.43.22"",""192.229.232.240"",""TCP"",""74"",""[TCP ACKed unseen segment] 52747  >  80 [ACK] Seq=1 Ack=2721 Win=515 Len=0 SLE=1 SRE=1361 SLE=5441 SRE=10881""";;;;;;;;;;;;;;;;;;0.415190;0.415153;#VALUE!;#VALUE!;#VALUE!;#VALUE!
"6,""0.309795"",""192.229.232.240"",""192.168.43.22"",""HTTP"",""1414"",""Continuation""";;;;;;;;;;;;;;;;;;0.509756;0.415190;#VALUE!;#VALUE!;#VALUE!;#VALUE!
"7,""0.309895"",""192.168.43.22"",""192.229.232.240"",""TCP"",""66"",""52746  >  80 [ACK] Seq=1 Ack=2721 Win=515 Len=0 SLE=5441 SRE=9521""";;;;;;;;;;;;;;;;;;0.509866;0.509756;#VALUE!;#VALUE!;#VALUE!;#VALUE!
"8,""0.334914"",""192.229.232.240"",""192.168.43.22"",""HTTP"",""2774"",""[TCP Previous segment not captured] Continuation""";;;;;;;;;;;;;;;;;;1.545.485;0.509866;#VALUE!;134;#VALUE!;#VALUE!
"9,""0.335041"",""192.168.43.22"",""192.229.232.240"",""TCP"",""54"",""[TCP ACKed unseen segment] 52747  >  80 [ACK] Seq=1 Ack=10881 Win=515 Len=0""";;;;;;;;;;;;;;;;;;1.545.619;1.545.485;134;454;134;320
"10,""0.335280"",""192.229.232.240"",""192.168.43.22"",""HTTP"",""1414"",""[TCP Previous segment not captured] Continuation""";;;;;;;;;;;;;;;;;;1.546.073;1.545.619;454;34;454;-420
"11,""0.335379"",""192.229.232.240"",""192.168.43.22"",""HTTP"",""1414"",""Continuation""";;;;;;;;;;;;;;;;;;1.546.107;1.546.073;34;22.467;34;22.433
"12,""0.335401"",""192.168.43.22"",""192.229.232.240"",""TCP"",""54"",""[TCP ACKed unseen segment] 52747  >  80 [ACK] Seq=1 Ack=13601 Win=515 Len=0""";;;;;;;;;;;;;;;;;;1.568.574;1.546.107;22.467;21.195;22.467;-1.272
"13,""0.346945"",""192.229.232.240"",""192.168.43.22"",""HTTP"",""1414"",""Continuation""";;;;;;;;;;;;;;;;;;1.589.769;1.568.574;21.195;116;21.195;-21.079
"14,""0.347044"",""192.168.43.22"",""192.229.232.240"",""TCP"",""66"",""52746  >  80 [ACK] Seq=1 Ack=4081 Win=515 Len=0 SLE=5441 SRE=9521""";;;;;;;;;;;;;;;;;;1.589.885;1.589.769;116;5.849;116;5.733
"15,""0.352890"",""192.229.232.240"",""192.168.43.22"",""HTTP"",""1414"",""Continuation""";;;;;;;;;;;;;;;;;;1.595.734;1.589.885;5.849;113;5.849;-5.736
"16,""0.353018"",""192.168.43.22"",""192.229.232.240"",""TCP"",""54"",""[TCP ACKed unseen segment] 52746  >  80 [ACK] Seq=1 Ack=9521 Win=515 Len=0""";;;;;;;;;;;;;;;;;;1.595.847;1.595.734;113;27.036;113;26.923
"17,""0.366938"",""192.229.232.240"",""192.168.43.22"",""HTTP"",""1414"",""[TCP Previous segment not captured] Continuation""";;;;;;;;;;;;;;;;;;1.622.883;1.595.847;27.036;5.975;27.036;-21.061
"18,""0.367037"",""192.168.43.22"",""192.229.232.240"",""TCP"",""66"",""[TCP Dup ACK 12#1] 52747  >  80 [ACK] Seq=1 Ack=13601 Win=515 Len=0 SLE=17681 SRE=19041""";;;;;;;;;;;;;;;;;;1.628.858;1.622.883;5.975;115;5.975;-5.860
"19,""0.372767"",""192.229.232.240"",""192.168.43.22"",""TCP"",""1414"",""[TCP Retransmission] 80  >  52747 [ACK] Seq=16321 Ack=1 Win=154 Len=1360""";;;;;;;;;;;;;;;;;;1.628.973;1.628.858;115;268;115;153
"20,""0.372877"",""192.168.43.22"",""192.229.232.240"",""TCP"",""66"",""[TCP Dup ACK 12#2] 52747  >  80 [ACK] Seq=1 Ack=13601 Win=515 Len=0 SLE=16321 SRE=19041""";;;;;;;;;;;;;;;;;;1.629.241;1.628.973;268;;268;0
"21,""0.414759"",""192.229.232.240"",""192.168.43.22"",""HTTP"",""1414"",""[TCP Previous segment not captured] Continuation""";;;;;;;;;;;;;;;;;;;;;;;
"22,""0.414876"",""192.168.43.22"",""192.229.232.240"",""TCP"",""74"",""[TCP Dup ACK 12#3] 52747  >  80 [ACK] Seq=1 Ack=13601 Win=515 Len=0 SLE=20401 SRE=21761 SLE=16321 SRE=19041""";;;;;;;;;;;;;;;;;;;total delay;83651;;total jitter;134
"23,""0.415153"",""192.229.232.240"",""192.168.43.22"",""TCP"",""1414"",""[TCP Out-Of-Order] 80  >  52747 [ACK] Seq=19041 Ack=1 Win=154 Len=1360""";;;;;;;;;;;;;;;;;;;rata2 delay;17,2832;;rata2 jitter;0,0276
"24,""0.415190"",""192.168.43.22"",""192.229.232.240"",""TCP"",""66"",""[TCP Dup ACK 12#4] 52747  >  80 [ACK] Seq=1 Ack=13601 Win=515 Len=0 SLE=16321 SRE=21761""";;;;;;;;;;;;;;;;;;;;;;;
"25,""0.509756"",""192.229.232.240"",""192.168.43.22"",""TCP"",""1414"",""[TCP Retransmission] 80  >  52747 [ACK] Seq=13601 Ack=1 Win=154 Len=1360""";;;;;;;;;;;;;;;;;;;;;;;
"26,""0.509866"",""192.168.43.22"",""192.229.232.240"",""TCP"",""66"",""52747  >  80 [ACK] Seq=1 Ack=14961 Win=515 Len=0 SLE=16321 SRE=21761""";;;;;;;;;;;;;;;;;;;;;;;
"27,""1.545485"",""192.229.232.240"",""192.168.43.22"",""TCP"",""1414"",""[TCP Retransmission] 80  >  52747 [ACK] Seq=14961 Ack=1 Win=154 Len=1360""";;;;;;;;;;;;;;;;;;;;;;;
"28,""1.545619"",""192.168.43.22"",""192.229.232.240"",""TCP"",""54"",""52747  >  80 [ACK] Seq=1 Ack=21761 Win=515 Len=0""";;;;;;;;;;;;;;;;;;;;;;;
"29,""1.546073"",""192.229.232.240"",""192.168.43.22"",""HTTP"",""1414"",""[TCP Spurious Retransmission] Continuation""";;;;;;;;;;;;;;;;;;;;;;;
"30,""1.546107"",""192.168.43.22"",""192.229.232.240"",""TCP"",""66"",""[TCP Dup ACK 28#1] 52747  >  80 [ACK] Seq=1 Ack=21761 Win=515 Len=0 SLE=14961 SRE=16321""";;;;;;;;;;;;;;;;;;;;;;;
"31,""1.568574"",""192.168.43.22"",""192.229.232.240"",""HTTP"",""491"",""GET /filestreamingservice/files/3a6e3973-1652-476a-a31a-1a15a3fab777?P1=1602185137&P2=402&P3=2&P4=Yp%2bpWUSA4iM2WCSE0J6nNZIoM1P2lurkID6zoW6ujZTd3WGmDPTcz6RxnotI07zVKXOfzG5T4i4ax6iD6C0Lhw%3d%3d HTTP/1.1 """;;;;;;;;;;;;;;;;;;;;;;;
"32,""1.589769"",""192.229.232.240"",""192.168.43.22"",""HTTP"",""1414"",""[TCP Previous segment not captured] Continuation""";;;;;;;;;;;;;;;;;;;;;;;
"33,""1.589885"",""192.168.43.22"",""192.229.232.240"",""TCP"",""66"",""[TCP Dup ACK 28#2] 52747  >  80 [ACK] Seq=1 Ack=21761 Win=515 Len=0 SLE=23121 SRE=24481""";;;;;;;;;;;;;;;;;;;;;;;
"34,""1.595734"",""192.229.232.240"",""192.168.43.22"",""HTTP"",""1414"",""Continuation""";;;;;;;;;;;;;;;;;;;;;;;
"35,""1.595847"",""192.168.43.22"",""192.229.232.240"",""TCP"",""66"",""[TCP Dup ACK 28#3] 52747  >  80 [ACK] Seq=1 Ack=21761 Win=515 Len=0 SLE=23121 SRE=25841""";;;;;;;;;;;;;;;;;;;;;;;
"36,""1.622883"",""192.229.232.240"",""192.168.43.22"",""TCP"",""1414"",""80  >  52755 [ACK] Seq=1 Ack=438 Win=147 Len=1360 [TCP segment of a reassembled PDU]""";;;;;;;;;;;;;;;;;;;;;;;
"37,""1.628858"",""192.229.232.240"",""192.168.43.22"",""TCP"",""1414"",""80  >  52755 [ACK] Seq=1361 Ack=438 Win=147 Len=1360 [TCP segment of a reassembled PDU]""";;;;;;;;;;;;;;;;;;;;;;;
"38,""1.628973"",""192.168.43.22"",""192.229.232.240"",""TCP"",""54"",""52755  >  80 [ACK] Seq=438 Ack=2721 Win=515 Len=0""";;;;;;;;;;;;;;;;;;;;;;;
"39,""1.629241"",""192.229.232.240"",""192.168.43.22"",""TCP"",""1414"",""80  >  52755 [ACK] Seq=2721 Ack=438 Win=147 Len=1360 [TCP segment of a reassembled PDU]""";;;;;;;;;;;;;;;;;;;;;;;
"40,""1.629543"",""192.229.232.240"",""192.168.43.22"",""TCP"",""1414"",""80  >  52755 [ACK] Seq=4081 Ack=438 Win=147 Len=1360 [TCP segment of a reassembled PDU]""";;;;;;;;;;;;;;;;;;;;;;;
"41,""1.629590"",""192.168.43.22"",""192.229.232.240"",""TCP"",""54"",""52755  >  80 [ACK] Seq=438 Ack=5441 Win=515 Len=0""";;;;;;;;;;;;;;;;;;;;;;;
"42,""1.649914"",""192.229.232.240"",""192.168.43.22"",""TCP"",""1414"",""[TCP Retransmission] 80  >  52747 [ACK] Seq=21761 Ack=1 Win=154 Len=1360""";;;;;;;;;;;;;;;;;;;;;;;
"43,""1.650039"",""192.168.43.22"",""192.229.232.240"",""TCP"",""54"",""52747  >  80 [ACK] Seq=1 Ack=25841 Win=515 Len=0""";;;;;;;;;;;;;;;;;;;;;;;
"44,""1.655872"",""192.229.232.240"",""192.168.43.22"",""HTTP"",""1414"",""Continuation""";;;;;;;;;;;;;;;;;;;;;;;
"45,""1.673888"",""192.229.232.240"",""192.168.43.22"",""TCP"",""1414"",""[TCP Previous segment not captured] 80  >  52755 [ACK] Seq=6801 Ack=438 Win=147 Len=1360 [TCP segment of a reassembled PDU]""";;;;;;;;;;;;;;;;;;;;;;;
"46,""1.674003"",""192.168.43.22"",""192.229.232.240"",""TCP"",""66"",""[TCP Dup ACK 41#1] 52755  >  80 [ACK] Seq=438 Ack=5441 Win=515 Len=0 SLE=6801 SRE=8161""";;;;;;;;;;;;;;;;;;;;;;;
"47,""1.686040"",""192.229.232.240"",""192.168.43.22"",""TCP"",""1414"",""[TCP Retransmission] 80  >  52755 [ACK] Seq=5441 Ack=438 Win=147 Len=1360""";;;;;;;;;;;;;;;;;;;;;;;
"48,""1.686170"",""192.168.43.22"",""192.229.232.240"",""TCP"",""54"",""52755  >  80 [ACK] Seq=438 Ack=8161 Win=515 Len=0""";;;;;;;;;;;;;;;;;;;;;;;
"49,""1.686528"",""192.229.232.240"",""192.168.43.22"",""TCP"",""1414"",""80  >  52755 [ACK] Seq=8161 Ack=438 Win=147 Len=1360 [TCP segment of a reassembled PDU]""";;;;;;;;;;;;;;;;;;;;;;;
"50,""1.686734"",""192.229.232.240"",""192.168.43.22"",""TCP"",""1414"",""80  >  52755 [ACK] Seq=9521 Ack=438 Win=147 Len=1360 [TCP segment of a reassembled PDU]""";;;;;;;;;;;;;;;;;;;;;;;
"51,""1.686768"",""192.168.43.22"",""192.229.232.240"",""TCP"",""54"",""52755  >  80 [ACK] Seq=438 Ack=10881 Win=515 Len=0""";;;;;;;;;;;;;;;;;;;;;;;
"52,""1.695756"",""192.168.43.22"",""192.229.232.240"",""TCP"",""54"",""52747  >  80 [ACK] Seq=1 Ack=27201 Win=515 Len=0""";;;;;;;;;;;;;;;;;;;;;;;
"53,""1.699707"",""192.229.232.240"",""192.168.43.22"",""HTTP"",""1414"",""Continuation""";;;;;;;;;;;;;;;;;;;;;;;
"54,""1.723845"",""192.229.232.240"",""192.168.43.22"",""TCP"",""1414"",""80  >  52755 [ACK] Seq=10881 Ack=438 Win=147 Len=1360 [TCP segment of a reassembled PDU]""";;;;;;;;;;;;;;;;;;;;;;;
"55,""1.729958"",""192.229.232.240"",""192.168.43.22"",""TCP"",""1414"",""80  >  52755 [ACK] Seq=12241 Ack=438 Win=147 Len=1360 [TCP segment of a reassembled PDU]""";;;;;;;;;;;;;;;;;;;;;;;
"56,""1.730070"",""192.168.43.22"",""192.229.232.240"",""TCP"",""54"",""52755  >  80 [ACK] Seq=438 Ack=13601 Win=515 Len=0""";;;;;;;;;;;;;;;;;;;;;;;
"57,""1.730328"",""192.229.232.240"",""192.168.43.22"",""TCP"",""1414"",""80  >  52755 [ACK] Seq=13601 Ack=438 Win=147 Len=1360 [TCP segment of a reassembled PDU]""";;;;;;;;;;;;;;;;;;;;;;;
"58,""1.730522"",""192.229.232.240"",""192.168.43.22"",""TCP"",""1414"",""80  >  52755 [ACK] Seq=14961 Ack=438 Win=147 Len=1360 [TCP segment of a reassembled PDU]""";;;;;;;;;;;;;;;;;;;;;;;
"59,""1.730555"",""192.168.43.22"",""192.229.232.240"",""TCP"",""54"",""52755  >  80 [ACK] Seq=438 Ack=16321 Win=515 Len=0""";;;;;;;;;;;;;;;;;;;;;;;
"60,""1.740894"",""192.168.43.22"",""192.229.232.240"",""TCP"",""54"",""52747  >  80 [ACK] Seq=1 Ack=28561 Win=515 Len=0""";;;;;;;;;;;;;;;;;;;;;;;
"61,""1.769940"",""192.229.232.240"",""192.168.43.22"",""TCP"",""1414"",""80  >  52755 [ACK] Seq=16321 Ack=438 Win=147 Len=1360 [TCP segment of a reassembled PDU]""";;;;;;;;;;;;;;;;;;;;;;;
"62,""1.770092"",""192.229.232.240"",""192.168.43.22"",""TCP"",""1414"",""80  >  52755 [ACK] Seq=17681 Ack=438 Win=147 Len=1360 [TCP segment of a reassembled PDU]""";;;;;;;;;;;;;;;;;;;;;;;
"63,""1.770147"",""192.168.43.22"",""192.229.232.240"",""TCP"",""54"",""52755  >  80 [ACK] Seq=438 Ack=19041 Win=515 Len=0""";;;;;;;;;;;;;;;;;;;;;;;
"64,""1.770509"",""192.229.232.240"",""192.168.43.22"",""TCP"",""1414"",""[TCP Previous segment not captured] 80  >  52755 [ACK] Seq=20401 Ack=438 Win=147 Len=1360 [TCP segment of a reassembled PDU]""";;;;;;;;;;;;;;;;;;;;;;;
"65,""1.770555"",""192.168.43.22"",""192.229.232.240"",""TCP"",""66"",""[TCP Dup ACK 63#1] 52755  >  80 [ACK] Seq=438 Ack=19041 Win=515 Len=0 SLE=20401 SRE=21761""";;;;;;;;;;;;;;;;;;;;;;;
"66,""1.782069"",""192.229.232.240"",""192.168.43.22"",""TCP"",""1414"",""80  >  52755 [ACK] Seq=21761 Ack=438 Win=147 Len=1360 [TCP segment of a reassembled PDU]""";;;;;;;;;;;;;;;;;;;;;;;
"67,""1.782230"",""192.168.43.22"",""192.229.232.240"",""TCP"",""66"",""[TCP Dup ACK 63#2] 52755  >  80 [ACK] Seq=438 Ack=19041 Win=515 Len=0 SLE=20401 SRE=23121""";;;;;;;;;;;;;;;;;;;;;;;
"68,""1.782562"",""192.229.232.240"",""192.168.43.22"",""TCP"",""1414"",""80  >  52755 [ACK] Seq=23121 Ack=438 Win=147 Len=1360 [TCP segment of a reassembled PDU]""";;;;;;;;;;;;;;;;;;;;;;;
"69,""1.782604"",""192.168.43.22"",""192.229.232.240"",""TCP"",""66"",""[TCP Dup ACK 63#3] 52755  >  80 [ACK] Seq=438 Ack=19041 Win=515 Len=0 SLE=20401 SRE=24481""";;;;;;;;;;;;;;;;;;;;;;;
"70,""1.782977"",""192.229.232.240"",""192.168.43.22"",""TCP"",""1414"",""[TCP Fast Retransmission] 80  >  52755 [ACK] Seq=19041 Ack=438 Win=147 Len=1360 [TCP segment of a reassembled PDU]""";;;;;;;;;;;;;;;;;;;;;;;
"71,""1.783025"",""192.168.43.22"",""192.229.232.240"",""TCP"",""54"",""52755  >  80 [ACK] Seq=438 Ack=24481 Win=515 Len=0""";;;;;;;;;;;;;;;;;;;;;;;
"72,""1.805777"",""192.229.232.240"",""192.168.43.22"",""TCP"",""1414"",""80  >  52755 [ACK] Seq=24481 Ack=438 Win=147 Len=1360 [TCP segment of a reassembled PDU]""";;;;;;;;;;;;;;;;;;;;;;;
"73,""1.811836"",""192.229.232.240"",""192.168.43.22"",""TCP"",""1414"",""80  >  52755 [ACK] Seq=25841 Ack=438 Win=147 Len=1360 [TCP segment of a reassembled PDU]""";;;;;;;;;;;;;;;;;;;;;;;
"74,""1.811956"",""192.168.43.22"",""192.229.232.240"",""TCP"",""54"",""52755  >  80 [ACK] Seq=438 Ack=27201 Win=515 Len=0""";;;;;;;;;;;;;;;;;;;;;;;
"75,""1.812233"",""192.229.232.240"",""192.168.43.22"",""TCP"",""1414"",""80  >  52755 [ACK] Seq=27201 Ack=438 Win=147 Len=1360 [TCP segment of a reassembled PDU]""";;;;;;;;;;;;;;;;;;;;;;;
"76,""1.845846"",""192.229.232.240"",""192.168.43.22"",""TCP"",""1414"",""80  >  52755 [ACK] Seq=28561 Ack=438 Win=147 Len=1360 [TCP segment of a reassembled PDU]""";;;;;;;;;;;;;;;;;;;;;;;
"77,""1.845957"",""192.168.43.22"",""192.229.232.240"",""TCP"",""54"",""52755  >  80 [ACK] Seq=438 Ack=29921 Win=515 Len=0""";;;;;;;;;;;;;;;;;;;;;;;
"78,""1.846224"",""192.229.232.240"",""192.168.43.22"",""TCP"",""1414"",""80  >  52755 [ACK] Seq=29921 Ack=438 Win=147 Len=1360 [TCP segment of a reassembled PDU]""";;;;;;;;;;;;;;;;;;;;;;;
"79,""1.857859"",""192.229.232.240"",""192.168.43.22"",""TCP"",""1414"",""80  >  52755 [ACK] Seq=31281 Ack=438 Win=147 Len=1360 [TCP segment of a reassembled PDU]""";;;;;;;;;;;;;;;;;;;;;;;
"80,""1.857971"",""192.168.43.22"",""192.229.232.240"",""TCP"",""54"",""52755  >  80 [ACK] Seq=438 Ack=32641 Win=515 Len=0""";;;;;;;;;;;;;;;;;;;;;;;
"81,""1.858248"",""192.229.232.240"",""192.168.43.22"",""TCP"",""1414"",""80  >  52755 [ACK] Seq=32641 Ack=438 Win=147 Len=1360 [TCP segment of a reassembled PDU]""";;;;;;;;;;;;;;;;;;;;;;;
"82,""1.858542"",""192.229.232.240"",""192.168.43.22"",""TCP"",""1414"",""80  >  52755 [ACK] Seq=34001 Ack=438 Win=147 Len=1360 [TCP segment of a reassembled PDU]""";;;;;;;;;;;;;;;;;;;;;;;
"83,""1.858589"",""192.168.43.22"",""192.229.232.240"",""TCP"",""54"",""52755  >  80 [ACK] Seq=438 Ack=35361 Win=515 Len=0""";;;;;;;;;;;;;;;;;;;;;;;
"84,""1.917872"",""192.229.232.240"",""192.168.43.22"",""TCP"",""1414"",""80  >  52755 [ACK] Seq=35361 Ack=438 Win=147 Len=1360 [TCP segment of a reassembled PDU]""";;;;;;;;;;;;;;;;;;;;;;;
"85,""1.918053"",""192.229.232.240"",""192.168.43.22"",""TCP"",""1414"",""80  >  52755 [ACK] Seq=36721 Ack=438 Win=147 Len=1360 [TCP segment of a reassembled PDU]""";;;;;;;;;;;;;;;;;;;;;;;
"86,""1.918111"",""192.168.43.22"",""192.229.232.240"",""TCP"",""54"",""52755  >  80 [ACK] Seq=438 Ack=38081 Win=515 Len=0""";;;;;;;;;;;;;;;;;;;;;;;
"87,""1.923767"",""192.229.232.240"",""192.168.43.22"",""TCP"",""1414"",""80  >  52755 [ACK] Seq=38081 Ack=438 Win=147 Len=1360 [TCP segment of a reassembled PDU]""";;;;;;;;;;;;;;;;;;;;;;;
"88,""1.923926"",""192.229.232.240"",""192.168.43.22"",""TCP"",""1414"",""80  >  52755 [ACK] Seq=39441 Ack=438 Win=147 Len=1360 [TCP segment of a reassembled PDU]""";;;;;;;;;;;;;;;;;;;;;;;
"89,""1.923977"",""192.168.43.22"",""192.229.232.240"",""TCP"",""54"",""52755  >  80 [ACK] Seq=438 Ack=40801 Win=515 Len=0""";;;;;;;;;;;;;;;;;;;;;;;
"90,""1.924342"",""192.229.232.240"",""192.168.43.22"",""TCP"",""1414"",""80  >  52755 [ACK] Seq=40801 Ack=438 Win=147 Len=1360 [TCP segment of a reassembled PDU]""";;;;;;;;;;;;;;;;;;;;;;;
"91,""1.939805"",""192.229.232.240"",""192.168.43.22"",""HTTP"",""1414"",""[TCP Spurious Retransmission] Continuation""";;;;;;;;;;;;;;;;;;;;;;;
"92,""1.939909"",""192.168.43.22"",""192.229.232.240"",""TCP"",""66"",""[TCP Dup ACK 1#1] [TCP ACKed unseen segment] 52748  >  80 [ACK] Seq=1 Ack=1 Win=515 Len=0 SLE=4294956417 SRE=4294957777""";;;;;;;;;;;;;;;;;;;;;;;
"93,""1.955828"",""192.229.232.240"",""192.168.43.22"",""TCP"",""1414"",""[TCP Previous segment not captured] 80  >  52755 [ACK] Seq=43521 Ack=438 Win=147 Len=1360 [TCP segment of a reassembled PDU]""";;;;;;;;;;;;;;;;;;;;;;;
"94,""1.955944"",""192.168.43.22"",""192.229.232.240"",""TCP"",""66"",""52755  >  80 [ACK] Seq=438 Ack=42161 Win=515 Len=0 SLE=43521 SRE=44881""";;;;;;;;;;;;;;;;;;;;;;;
"95,""1.956209"",""192.229.232.240"",""192.168.43.22"",""TCP"",""1414"",""80  >  52755 [ACK] Seq=44881 Ack=438 Win=147 Len=1360 [TCP segment of a reassembled PDU]""";;;;;;;;;;;;;;;;;;;;;;;
"96,""1.956249"",""192.168.43.22"",""192.229.232.240"",""TCP"",""66"",""[TCP Dup ACK 94#1] 52755  >  80 [ACK] Seq=438 Ack=42161 Win=515 Len=0 SLE=43521 SRE=46241""";;;;;;;;;;;;;;;;;;;;;;;
"97,""1.967766"",""192.229.232.240"",""192.168.43.22"",""TCP"",""1414"",""80  >  52755 [ACK] Seq=46241 Ack=438 Win=147 Len=1360 [TCP segment of a reassembled PDU]""";;;;;;;;;;;;;;;;;;;;;;;
"98,""1.967881"",""192.168.43.22"",""192.229.232.240"",""TCP"",""66"",""[TCP Dup ACK 94#2] 52755  >  80 [ACK] Seq=438 Ack=42161 Win=515 Len=0 SLE=43521 SRE=47601""";;;;;;;;;;;;;;;;;;;;;;;
"99,""1.968239"",""192.229.232.240"",""192.168.43.22"",""TCP"",""1414"",""80  >  52755 [ACK] Seq=47601 Ack=438 Win=147 Len=1360 [TCP segment of a reassembled PDU]""";;;;;;;;;;;;;;;;;;;;;;;
"100,""1.968277"",""192.168.43.22"",""192.229.232.240"",""TCP"",""66"",""[TCP Dup ACK 94#3] 52755  >  80 [ACK] Seq=438 Ack=42161 Win=515 Len=0 SLE=43521 SRE=48961""";;;;;;;;;;;;;;;;;;;;;;;
"101,""1.975901"",""192.229.232.240"",""192.168.43.22"",""HTTP"",""1414"",""[TCP Previous segment not captured] Continuation""";;;;;;;;;;;;;;;;;;;;;;;
"102,""1.976010"",""192.168.43.22"",""192.229.232.240"",""TCP"",""66"",""[TCP Dup ACK 1#2] [TCP ACKed unseen segment] 52748  >  80 [ACK] Seq=1 Ack=1 Win=515 Len=0 SLE=1361 SRE=2721""";;;;;;;;;;;;;;;;;;;;;;;
"103,""1.982096"",""192.229.232.240"",""192.168.43.22"",""HTTP"",""2774"",""Continuation""";;;;;;;;;;;;;;;;;;;;;;;
"104,""1.982206"",""192.168.43.22"",""192.229.232.240"",""TCP"",""66"",""[TCP Dup ACK 1#3] 52748  >  80 [ACK] Seq=1 Ack=1 Win=515 Len=0 SLE=1361 SRE=5441""";;;;;;;;;;;;;;;;;;;;;;;
"105,""1.982491"",""192.229.232.240"",""192.168.43.22"",""HTTP"",""1414"",""Continuation""";;;;;;;;;;;;;;;;;;;;;;;
"106,""1.982534"",""192.168.43.22"",""192.229.232.240"",""TCP"",""66"",""[TCP Dup ACK 1#4] 52748  >  80 [ACK] Seq=1 Ack=1 Win=515 Len=0 SLE=1361 SRE=6801""";;;;;;;;;;;;;;;;;;;;;;;
"107,""1.982903"",""192.229.232.240"",""192.168.43.22"",""HTTP"",""1414"",""[TCP Fast Retransmission] Continuation""";;;;;;;;;;;;;;;;;;;;;;;
"108,""1.982959"",""192.168.43.22"",""192.229.232.240"",""TCP"",""54"",""52748  >  80 [ACK] Seq=1 Ack=6801 Win=515 Len=0""";;;;;;;;;;;;;;;;;;;;;;;
"109,""1.995929"",""192.229.232.240"",""192.168.43.22"",""TCP"",""1414"",""80  >  52755 [ACK] Seq=48961 Ack=438 Win=147 Len=1360 [TCP segment of a reassembled PDU]""";;;;;;;;;;;;;;;;;;;;;;;
"110,""1.996053"",""192.168.43.22"",""192.229.232.240"",""TCP"",""66"",""[TCP Dup ACK 94#4] 52755  >  80 [ACK] Seq=438 Ack=42161 Win=515 Len=0 SLE=43521 SRE=50321""";;;;;;;;;;;;;;;;;;;;;;;
"111,""2.001865"",""192.229.232.240"",""192.168.43.22"",""TCP"",""1414"",""80  >  52755 [ACK] Seq=50321 Ack=438 Win=147 Len=1360 [TCP segment of a reassembled PDU]""";;;;;;;;;;;;;;;;;;;;;;;
"112,""2.001979"",""192.168.43.22"",""192.229.232.240"",""TCP"",""66"",""[TCP Dup ACK 94#5] 52755  >  80 [ACK] Seq=438 Ack=42161 Win=515 Len=0 SLE=43521 SRE=51681""";;;;;;;;;;;;;;;;;;;;;;;
"113,""2.002352"",""192.229.232.240"",""192.168.43.22"",""TCP"",""1414"",""[TCP Fast Retransmission] 80  >  52755 [ACK] Seq=42161 Ack=438 Win=147 Len=1360 [TCP segment of a reassembled PDU]""";;;;;;;;;;;;;;;;;;;;;;;
"114,""2.002409"",""192.168.43.22"",""192.229.232.240"",""TCP"",""54"",""52755  >  80 [ACK] Seq=438 Ack=51681 Win=515 Len=0""";;;;;;;;;;;;;;;;;;;;;;;
"115,""2.007856"",""192.229.232.240"",""192.168.43.22"",""TCP"",""1414"",""80  >  52755 [ACK] Seq=51681 Ack=438 Win=147 Len=1360 [TCP segment of a reassembled PDU]""";;;;;;;;;;;;;;;;;;;;;;;
"116,""2.047956"",""192.168.43.22"",""192.229.232.240"",""TCP"",""54"",""52755  >  80 [ACK] Seq=438 Ack=53041 Win=515 Len=0""";;;;;;;;;;;;;;;;;;;;;;;
"117,""2.109863"",""192.229.232.240"",""192.168.43.22"",""TCP"",""1414"",""[TCP Previous segment not captured] 80  >  52755 [ACK] Seq=57121 Ack=438 Win=147 Len=1360 [TCP segment of a reassembled PDU]""";;;;;;;;;;;;;;;;;;;;;;;
"118,""2.109978"",""192.168.43.22"",""192.229.232.240"",""TCP"",""66"",""[TCP Dup ACK 116#1] 52755  >  80 [ACK] Seq=438 Ack=53041 Win=515 Len=0 SLE=57121 SRE=58481""";;;;;;;;;;;;;;;;;;;;;;;
"119,""2.121765"",""192.229.232.240"",""192.168.43.22"",""HTTP"",""1414"",""Continuation""";;;;;;;;;;;;;;;;;;;;;;;
"120,""2.162138"",""192.168.43.22"",""192.229.232.240"",""TCP"",""54"",""52748  >  80 [ACK] Seq=1 Ack=8161 Win=515 Len=0""";;;;;;;;;;;;;;;;;;;;;;;
"121,""2.230069"",""192.229.232.240"",""192.168.43.22"",""HTTP"",""1414"",""Continuation""";;;;;;;;;;;;;;;;;;;;;;;
"122,""2.236332"",""192.229.232.240"",""192.168.43.22"",""HTTP"",""4134"",""Continuation""";;;;;;;;;;;;;;;;;;;;;;;
"123,""2.236453"",""192.168.43.22"",""192.229.232.240"",""TCP"",""54"",""52748  >  80 [ACK] Seq=1 Ack=13601 Win=515 Len=0""";;;;;;;;;;;;;;;;;;;;;;;
"124,""2.236788"",""192.229.232.240"",""192.168.43.22"",""HTTP"",""1414"",""Continuation""";;;;;;;;;;;;;;;;;;;;;;;
"125,""2.237099"",""192.229.232.240"",""192.168.43.22"",""HTTP"",""1414"",""Continuation""";;;;;;;;;;;;;;;;;;;;;;;
"126,""2.237144"",""192.168.43.22"",""192.229.232.240"",""TCP"",""54"",""52748  >  80 [ACK] Seq=1 Ack=16321 Win=515 Len=0""";;;;;;;;;;;;;;;;;;;;;;;
"127,""2.237426"",""192.229.232.240"",""192.168.43.22"",""HTTP"",""1414"",""Continuation""";;;;;;;;;;;;;;;;;;;;;;;
"128,""2.275898"",""192.229.232.240"",""192.168.43.22"",""HTTP"",""1414"",""[TCP Previous segment not captured] Continuation""";;;;;;;;;;;;;;;;;;;;;;;
"129,""2.276016"",""192.168.43.22"",""192.229.232.240"",""TCP"",""66"",""52748  >  80 [ACK] Seq=1 Ack=17681 Win=515 Len=0 SLE=19041 SRE=20401""";;;;;;;;;;;;;;;;;;;;;;;
"130,""2.282021"",""192.229.232.240"",""192.168.43.22"",""HTTP"",""2774"",""Continuation""";;;;;;;;;;;;;;;;;;;;;;;
"131,""2.282147"",""192.168.43.22"",""192.229.232.240"",""TCP"",""66"",""[TCP Dup ACK 129#1] 52748  >  80 [ACK] Seq=1 Ack=17681 Win=515 Len=0 SLE=19041 SRE=23121""";;;;;;;;;;;;;;;;;;;;;;;
"132,""2.282476"",""192.229.232.240"",""192.168.43.22"",""HTTP"",""1414"",""Continuation""";;;;;;;;;;;;;;;;;;;;;;;
"133,""2.282512"",""192.168.43.22"",""192.229.232.240"",""TCP"",""66"",""[TCP Dup ACK 129#2] 52748  >  80 [ACK] Seq=1 Ack=17681 Win=515 Len=0 SLE=19041 SRE=24481""";;;;;;;;;;;;;;;;;;;;;;;
"134,""2.282882"",""192.229.232.240"",""192.168.43.22"",""HTTP"",""1414"",""Continuation""";;;;;;;;;;;;;;;;;;;;;;;
"135,""2.282918"",""192.168.43.22"",""192.229.232.240"",""TCP"",""66"",""[TCP Dup ACK 129#3] 52748  >  80 [ACK] Seq=1 Ack=17681 Win=515 Len=0 SLE=19041 SRE=25841""";;;;;;;;;;;;;;;;;;;;;;;
"136,""2.283213"",""192.229.232.240"",""192.168.43.22"",""HTTP"",""1414"",""[TCP Fast Retransmission] Continuation""";;;;;;;;;;;;;;;;;;;;;;;
"137,""2.283262"",""192.168.43.22"",""192.229.232.240"",""TCP"",""54"",""52748  >  80 [ACK] Seq=1 Ack=25841 Win=515 Len=0""";;;;;;;;;;;;;;;;;;;;;;;
"144,""2.350093"",""192.229.232.240"",""192.168.43.22"",""HTTP"",""1414"",""Continuation""";;;;;;;;;;;;;;;;;;;;;;;
"145,""2.350328"",""192.229.232.240"",""192.168.43.22"",""HTTP"",""1414"",""Continuation""";;;;;;;;;;;;;;;;;;;;;;;
"146,""2.350383"",""192.168.43.22"",""192.229.232.240"",""TCP"",""54"",""52748  >  80 [ACK] Seq=1 Ack=28561 Win=515 Len=0""";;;;;;;;;;;;;;;;;;;;;;;
"147,""2.356376"",""192.229.232.240"",""192.168.43.22"",""HTTP"",""1414"",""Continuation""";;;;;;;;;;;;;;;;;;;;;;;
"148,""2.356376"",""192.229.232.240"",""192.168.43.22"",""HTTP"",""1414"",""[TCP Previous segment not captured] Continuation""";;;;;;;;;;;;;;;;;;;;;;;
"149,""2.356523"",""192.168.43.22"",""192.229.232.240"",""TCP"",""66"",""52748  >  80 [ACK] Seq=1 Ack=29921 Win=515 Len=0 SLE=31281 SRE=32641""";;;;;;;;;;;;;;;;;;;;;;;
"150,""2.356849"",""192.229.232.240"",""192.168.43.22"",""TCP"",""1414"",""[TCP Out-Of-Order] 80  >  52748 [ACK] Seq=29921 Ack=1 Win=147 Len=1360""";;;;;;;;;;;;;;;;;;;;;;;
"151,""2.356895"",""192.168.43.22"",""192.229.232.240"",""TCP"",""54"",""52748  >  80 [ACK] Seq=1 Ack=32641 Win=515 Len=0""";;;;;;;;;;;;;;;;;;;;;;;
"152,""2.357154"",""192.229.232.240"",""192.168.43.22"",""HTTP"",""1414"",""Continuation""";;;;;;;;;;;;;;;;;;;;;;;
"153,""2.357197"",""192.168.43.22"",""192.229.232.240"",""TCP"",""54"",""52748  >  80 [ACK] Seq=1 Ack=34001 Win=515 Len=0""";;;;;;;;;;;;;;;;;;;;;;;
"154,""2.357565"",""192.229.232.240"",""192.168.43.22"",""HTTP"",""1414"",""Continuation""";;;;;;;;;;;;;;;;;;;;;;;
"155,""2.389716"",""192.229.232.240"",""192.168.43.22"",""HTTP"",""1414"",""Continuation""";;;;;;;;;;;;;;;;;;;;;;;
"156,""2.389836"",""192.168.43.22"",""192.229.232.240"",""TCP"",""54"",""52748  >  80 [ACK] Seq=1 Ack=36721 Win=515 Len=0""";;;;;;;;;;;;;;;;;;;;;;;
"157,""2.395618"",""192.229.232.240"",""192.168.43.22"",""HTTP"",""1414"",""Continuation""";;;;;;;;;;;;;;;;;;;;;;;
"158,""2.436051"",""192.168.43.22"",""192.229.232.240"",""TCP"",""54"",""52748  >  80 [ACK] Seq=1 Ack=38081 Win=515 Len=0""";;;;;;;;;;;;;;;;;;;;;;;
"159,""2.468888"",""192.229.232.240"",""192.168.43.22"",""HTTP"",""1414"",""[TCP Previous segment not captured] Continuation""";;;;;;;;;;;;;;;;;;;;;;;
"160,""2.469010"",""192.168.43.22"",""192.229.232.240"",""TCP"",""66"",""[TCP Dup ACK 158#1] 52748  >  80 [ACK] Seq=1 Ack=38081 Win=515 Len=0 SLE=43521 SRE=44881""";;;;;;;;;;;;;;;;;;;;;;;
"161,""2.474813"",""192.229.232.240"",""192.168.43.22"",""HTTP"",""1414"",""Continuation""";;;;;;;;;;;;;;;;;;;;;;;
"162,""2.474931"",""192.168.43.22"",""192.229.232.240"",""TCP"",""66"",""[TCP Dup ACK 158#2] 52748  >  80 [ACK] Seq=1 Ack=38081 Win=515 Len=0 SLE=43521 SRE=46241""";;;;;;;;;;;;;;;;;;;;;;;
"163,""2.475398"",""192.229.232.240"",""192.168.43.22"",""HTTP"",""1329"",""Continuation""";;;;;;;;;;;;;;;;;;;;;;;
"164,""2.475449"",""192.168.43.22"",""192.229.232.240"",""TCP"",""66"",""[TCP Dup ACK 158#3] 52748  >  80 [ACK] Seq=1 Ack=38081 Win=515 Len=0 SLE=43521 SRE=47516""";;;;;;;;;;;;;;;;;;;;;;;
"165,""2.475687"",""192.229.232.240"",""192.168.43.22"",""TCP"",""1414"",""[TCP Retransmission] 80  >  52755 [ACK] Seq=53041 Ack=438 Win=147 Len=1360""";;;;;;;;;;;;;;;;;;;;;;;
"166,""2.475755"",""192.168.43.22"",""192.229.232.240"",""TCP"",""66"",""52755  >  80 [ACK] Seq=438 Ack=54401 Win=515 Len=0 SLE=57121 SRE=58481""";;;;;;;;;;;;;;;;;;;;;;;
"167,""2.512765"",""192.229.232.240"",""192.168.43.22"",""TCP"",""1414"",""[TCP Retransmission] 80  >  52755 [ACK] Seq=54401 Ack=438 Win=147 Len=1360""";;;;;;;;;;;;;;;;;;;;;;;
"168,""2.512885"",""192.168.43.22"",""192.229.232.240"",""TCP"",""66"",""52755  >  80 [ACK] Seq=438 Ack=55761 Win=515 Len=0 SLE=57121 SRE=58481""";;;;;;;;;;;;;;;;;;;;;;;
"169,""2.518751"",""192.229.232.240"",""192.168.43.22"",""TCP"",""1414"",""[TCP Retransmission] 80  >  52755 [ACK] Seq=55761 Ack=438 Win=147 Len=1360""";;;;;;;;;;;;;;;;;;;;;;;
"170,""2.518894"",""192.168.43.22"",""192.229.232.240"",""TCP"",""54"",""52755  >  80 [ACK] Seq=438 Ack=58481 Win=515 Len=0""";;;;;;;;;;;;;;;;;;;;;;;
"171,""2.549683"",""192.229.232.240"",""192.168.43.22"",""TCP"",""1414"",""80  >  52755 [ACK] Seq=58481 Ack=438 Win=147 Len=1360 [TCP segment of a reassembled PDU]""";;;;;;;;;;;;;;;;;;;;;;;
"172,""2.555686"",""192.229.232.240"",""192.168.43.22"",""TCP"",""1414"",""80  >  52755 [ACK] Seq=59841 Ack=438 Win=147 Len=1360 [TCP segment of a reassembled PDU]""";;;;;;;;;;;;;;;;;;;;;;;
"173,""2.555763"",""192.168.43.22"",""192.229.232.240"",""TCP"",""54"",""52755  >  80 [ACK] Seq=438 Ack=61201 Win=515 Len=0""";;;;;;;;;;;;;;;;;;;;;;;
"174,""2.565747"",""192.229.232.240"",""192.168.43.22"",""TCP"",""1414"",""[TCP Retransmission] 80  >  52748 [ACK] Seq=38081 Ack=1 Win=147 Len=1360""";;;;;;;;;;;;;;;;;;;;;;;
"175,""2.565863"",""192.168.43.22"",""192.229.232.240"",""TCP"",""66"",""52748  >  80 [ACK] Seq=1 Ack=39441 Win=515 Len=0 SLE=43521 SRE=47516""";;;;;;;;;;;;;;;;;;;;;;;
"176,""2.629780"",""192.229.232.240"",""192.168.43.22"",""TCP"",""1414"",""80  >  52755 [ACK] Seq=61201 Ack=438 Win=147 Len=1360 [TCP segment of a reassembled PDU]""";;;;;;;;;;;;;;;;;;;;;;;
"177,""2.629935"",""192.229.232.240"",""192.168.43.22"",""TCP"",""1414"",""80  >  52755 [ACK] Seq=62561 Ack=438 Win=147 Len=1360 [TCP segment of a reassembled PDU]""";;;;;;;;;;;;;;;;;;;;;;;
"178,""2.629989"",""192.168.43.22"",""192.229.232.240"",""TCP"",""54"",""52755  >  80 [ACK] Seq=438 Ack=63921 Win=515 Len=0""";;;;;;;;;;;;;;;;;;;;;;;
"179,""2.635849"",""192.229.232.240"",""192.168.43.22"",""TCP"",""1414"",""80  >  52755 [ACK] Seq=63921 Ack=438 Win=147 Len=1360 [TCP segment of a reassembled PDU]""";;;;;;;;;;;;;;;;;;;;;;;
"180,""2.635849"",""192.229.232.240"",""192.168.43.22"",""TCP"",""1331"",""80  >  52755 [PSH, ACK] Seq=65281 Ack=438 Win=147 Len=1277 [TCP segment of a reassembled PDU]""";;;;;;;;;;;;;;;;;;;;;;;
"181,""2.635984"",""192.168.43.22"",""192.229.232.240"",""TCP"",""54"",""52755  >  80 [ACK] Seq=438 Ack=66558 Win=515 Len=0""";;;;;;;;;;;;;;;;;;;;;;;
"182,""2.636320"",""192.229.232.240"",""192.168.43.22"",""TCP"",""1414"",""[TCP Retransmission] 80  >  52748 [ACK] Seq=39441 Ack=1 Win=147 Len=1360""";;;;;;;;;;;;;;;;;;;;;;;
"183,""2.636366"",""192.168.43.22"",""192.229.232.240"",""TCP"",""66"",""52748  >  80 [ACK] Seq=1 Ack=40801 Win=515 Len=0 SLE=43521 SRE=47516""";;;;;;;;;;;;;;;;;;;;;;;
"184,""2.636737"",""192.229.232.240"",""192.168.43.22"",""TCP"",""1414"",""[TCP Retransmission] 80  >  52748 [ACK] Seq=40801 Ack=1 Win=147 Len=1360""";;;;;;;;;;;;;;;;;;;;;;;
"185,""2.636790"",""192.168.43.22"",""192.229.232.240"",""TCP"",""66"",""52748  >  80 [ACK] Seq=1 Ack=42161 Win=515 Len=0 SLE=43521 SRE=47516""";;;;;;;;;;;;;;;;;;;;;;;
"186,""2.675711"",""192.229.232.240"",""192.168.43.22"",""TCP"",""1414"",""[TCP Retransmission] 80  >  52748 [ACK] Seq=42161 Ack=1 Win=147 Len=1360""";;;;;;;;;;;;;;;;;;;;;;;
"187,""2.675860"",""192.168.43.22"",""192.229.232.240"",""TCP"",""54"",""52748  >  80 [ACK] Seq=1 Ack=47516 Win=515 Len=0""";;;;;;;;;;;;;;;;;;;;;;;
"188,""2.677365"",""192.168.43.22"",""192.229.232.240"",""HTTP"",""491"",""GET /filestreamingservice/files/4e6356d9-c60d-444b-bf25-60a1b6fce4a6?P1=1602184095&P2=402&P3=2&P4=igOKERQ8NS2eqL4M79k%2bS7em8HkdWuvb5WfomKqVxuMmqJ4NqA15LDRKKMjm6CjHdBOZOxwASQrneO0EAiZZMA%3d%3d HTTP/1.1 """;;;;;;;;;;;;;;;;;;;;;;;
"189,""2.750229"",""192.229.232.240"",""192.168.43.22"",""TCP"",""1414"",""80  >  52748 [ACK] Seq=47516 Ack=438 Win=149 Len=1360 [TCP segment of a reassembled PDU]""";;;;;;;;;;;;;;;;;;;;;;;
"190,""2.750502"",""192.229.232.240"",""192.168.43.22"",""TCP"",""1414"",""[TCP Previous segment not captured] 80  >  52748 [ACK] Seq=50236 Ack=438 Win=149 Len=1360 [TCP segment of a reassembled PDU]""";;;;;;;;;;;;;;;;;;;;;;;
"191,""2.750570"",""192.168.43.22"",""192.229.232.240"",""TCP"",""66"",""52748  >  80 [ACK] Seq=438 Ack=48876 Win=515 Len=0 SLE=50236 SRE=51596""";;;;;;;;;;;;;;;;;;;;;;;
"192,""2.756370"",""192.229.232.240"",""192.168.43.22"",""TCP"",""2774"",""80  >  52748 [ACK] Seq=51596 Ack=438 Win=149 Len=2720 [TCP segment of a reassembled PDU]""";;;;;;;;;;;;;;;;;;;;;;;
"193,""2.756498"",""192.168.43.22"",""192.229.232.240"",""TCP"",""66"",""[TCP Dup ACK 191#1] 52748  >  80 [ACK] Seq=438 Ack=48876 Win=515 Len=0 SLE=50236 SRE=54316""";;;;;;;;;;;;;;;;;;;;;;;
"194,""2.756773"",""192.229.232.240"",""192.168.43.22"",""TCP"",""1414"",""[TCP Out-Of-Order] 80  >  52748 [ACK] Seq=48876 Ack=438 Win=149 Len=1360 [TCP segment of a reassembled PDU]""";;;;;;;;;;;;;;;;;;;;;;;
"195,""2.756903"",""192.168.43.22"",""192.229.232.240"",""TCP"",""54"",""52748  >  80 [ACK] Seq=438 Ack=54316 Win=515 Len=0""";;;;;;;;;;;;;;;;;;;;;;;
"196,""2.757198"",""192.229.232.240"",""192.168.43.22"",""HTTP"",""1414"",""[TCP Spurious Retransmission] Continuation""";;;;;;;;;;;;;;;;;;;;;;;
"197,""2.757243"",""192.168.43.22"",""192.229.232.240"",""TCP"",""66"",""[TCP Dup ACK 60#1] 52747  >  80 [ACK] Seq=1 Ack=28561 Win=515 Len=0 SLE=25841 SRE=27201""";;;;;;;;;;;;;;;;;;;;;;;
"198,""2.789686"",""192.229.232.240"",""192.168.43.22"",""TCP"",""1414"",""[TCP Previous segment not captured] 80  >  52748 [ACK] Seq=55676 Ack=438 Win=149 Len=1360 [TCP segment of a reassembled PDU]""";;;;;;;;;;;;;;;;;;;;;;;
"199,""2.789802"",""192.168.43.22"",""192.229.232.240"",""TCP"",""66"",""[TCP Dup ACK 195#1] 52748  >  80 [ACK] Seq=438 Ack=54316 Win=515 Len=0 SLE=55676 SRE=57036""";;;;;;;;;;;;;;;;;;;;;;;
"200,""2.790087"",""192.229.232.240"",""192.168.43.22"",""TCP"",""1414"",""[TCP Out-Of-Order] 80  >  52748 [ACK] Seq=54316 Ack=438 Win=149 Len=1360 [TCP segment of a reassembled PDU]""";;;;;;;;;;;;;;;;;;;;;;;
"201,""2.790140"",""192.168.43.22"",""192.229.232.240"",""TCP"",""54"",""52748  >  80 [ACK] Seq=438 Ack=57036 Win=515 Len=0""";;;;;;;;;;;;;;;;;;;;;;;
"202,""2.801837"",""192.229.232.240"",""192.168.43.22"",""TCP"",""2774"",""80  >  52748 [ACK] Seq=57036 Ack=438 Win=149 Len=2720 [TCP segment of a reassembled PDU]""";;;;;;;;;;;;;;;;;;;;;;;
"203,""2.801964"",""192.168.43.22"",""192.229.232.240"",""TCP"",""54"",""52748  >  80 [ACK] Seq=438 Ack=59756 Win=515 Len=0""";;;;;;;;;;;;;;;;;;;;;;;
"204,""2.802214"",""192.229.232.240"",""192.168.43.22"",""TCP"",""1414"",""80  >  52748 [ACK] Seq=59756 Ack=438 Win=149 Len=1360 [TCP segment of a reassembled PDU]""";;;;;;;;;;;;;;;;;;;;;;;
"205,""2.802523"",""192.229.232.240"",""192.168.43.22"",""TCP"",""1414"",""80  >  52748 [ACK] Seq=61116 Ack=438 Win=149 Len=1360 [TCP segment of a reassembled PDU]""";;;;;;;;;;;;;;;;;;;;;;;
"206,""2.802569"",""192.168.43.22"",""192.229.232.240"",""TCP"",""54"",""52748  >  80 [ACK] Seq=438 Ack=62476 Win=515 Len=0""";;;;;;;;;;;;;;;;;;;;;;;
"207,""2.802830"",""192.229.232.240"",""192.168.43.22"",""HTTP"",""1414"",""[TCP Previous segment not captured] Continuation""";;;;;;;;;;;;;;;;;;;;;;;
"208,""2.802882"",""192.168.43.22"",""192.229.232.240"",""TCP"",""66"",""[TCP Dup ACK 60#2] 52747  >  80 [ACK] Seq=1 Ack=28561 Win=515 Len=0 SLE=29921 SRE=31281""";;;;;;;;;;;;;;;;;;;;;;;
"209,""2.829665"",""192.229.232.240"",""192.168.43.22"",""TCP"",""1414"",""80  >  52748 [ACK] Seq=62476 Ack=438 Win=149 Len=1360 [TCP segment of a reassembled PDU]""";;;;;;;;;;;;;;;;;;;;;;;
"210,""2.829849"",""192.229.232.240"",""192.168.43.22"",""TCP"",""1414"",""80  >  52748 [ACK] Seq=63836 Ack=438 Win=149 Len=1360 [TCP segment of a reassembled PDU]""";;;;;;;;;;;;;;;;;;;;;;;
"211,""2.829914"",""192.168.43.22"",""192.229.232.240"",""TCP"",""54"",""52748  >  80 [ACK] Seq=438 Ack=65196 Win=515 Len=0""";;;;;;;;;;;;;;;;;;;;;;;
"212,""2.845653"",""192.229.232.240"",""192.168.43.22"",""TCP"",""1414"",""80  >  52748 [ACK] Seq=65196 Ack=438 Win=149 Len=1360 [TCP segment of a reassembled PDU]""";;;;;;;;;;;;;;;;;;;;;;;
"213,""2.851653"",""192.229.232.240"",""192.168.43.22"",""TCP"",""1414"",""[TCP Retransmission] 80  >  52747 [ACK] Seq=28561 Ack=1 Win=154 Len=1360""";;;;;;;;;;;;;;;;;;;;;;;
"214,""2.851782"",""192.168.43.22"",""192.229.232.240"",""TCP"",""54"",""52747  >  80 [ACK] Seq=1 Ack=31281 Win=515 Len=0""";;;;;;;;;;;;;;;;;;;;;;;
"215,""2.869571"",""192.229.232.240"",""192.168.43.22"",""TCP"",""1414"",""[TCP Previous segment not captured] 80  >  52748 [ACK] Seq=70636 Ack=438 Win=149 Len=1360 [TCP segment of a reassembled PDU]""";;;;;;;;;;;;;;;;;;;;;;;
"216,""2.869692"",""192.168.43.22"",""192.229.232.240"",""TCP"",""66"",""52748  >  80 [ACK] Seq=438 Ack=66556 Win=515 Len=0 SLE=70636 SRE=71996""";;;;;;;;;;;;;;;;;;;;;;;
"217,""2.870053"",""192.229.232.240"",""192.168.43.22"",""TCP"",""1414"",""80  >  52748 [ACK] Seq=71996 Ack=438 Win=149 Len=1360 [TCP segment of a reassembled PDU]""";;;;;;;;;;;;;;;;;;;;;;;
"218,""2.870100"",""192.168.43.22"",""192.229.232.240"",""TCP"",""66"",""[TCP Dup ACK 216#1] 52748  >  80 [ACK] Seq=438 Ack=66556 Win=515 Len=0 SLE=70636 SRE=73356""";;;;;;;;;;;;;;;;;;;;;;;
"219,""2.910448"",""192.229.232.240"",""192.168.43.22"",""TCP"",""1414"",""80  >  52748 [ACK] Seq=73356 Ack=438 Win=149 Len=1360 [TCP segment of a reassembled PDU]""";;;;;;;;;;;;;;;;;;;;;;;
"220,""2.910548"",""192.168.43.22"",""192.229.232.240"",""TCP"",""66"",""[TCP Dup ACK 216#2] 52748  >  80 [ACK] Seq=438 Ack=66556 Win=515 Len=0 SLE=70636 SRE=74716""";;;;;;;;;;;;;;;;;;;;;;;
"221,""2.916492"",""192.229.232.240"",""192.168.43.22"",""TCP"",""1414"",""80  >  52748 [ACK] Seq=74716 Ack=438 Win=149 Len=1360 [TCP segment of a reassembled PDU]""";;;;;;;;;;;;;;;;;;;;;;;
"222,""2.916591"",""192.168.43.22"",""192.229.232.240"",""TCP"",""66"",""[TCP Dup ACK 216#3] 52748  >  80 [ACK] Seq=438 Ack=66556 Win=515 Len=0 SLE=70636 SRE=76076""";;;;;;;;;;;;;;;;;;;;;;;
"223,""2.916871"",""192.229.232.240"",""192.168.43.22"",""TCP"",""1414"",""80  >  52748 [ACK] Seq=76076 Ack=438 Win=149 Len=1360 [TCP segment of a reassembled PDU]""";;;;;;;;;;;;;;;;;;;;;;;
"224,""2.916897"",""192.168.43.22"",""192.229.232.240"",""TCP"",""66"",""[TCP Dup ACK 216#4] 52748  >  80 [ACK] Seq=438 Ack=66556 Win=515 Len=0 SLE=70636 SRE=77436""";;;;;;;;;;;;;;;;;;;;;;;
"225,""2.989734"",""192.229.232.240"",""192.168.43.22"",""TCP"",""1414"",""[TCP Retransmission] 80  >  52748 [ACK] Seq=67916 Ack=438 Win=149 Len=1360""";;;;;;;;;;;;;;;;;;;;;;;
"226,""2.989859"",""192.168.43.22"",""192.229.232.240"",""TCP"",""74"",""[TCP Dup ACK 216#5] 52748  >  80 [ACK] Seq=438 Ack=66556 Win=515 Len=0 SLE=67916 SRE=69276 SLE=70636 SRE=77436""";;;;;;;;;;;;;;;;;;;;;;;
"227,""3.001679"",""192.229.232.240"",""192.168.43.22"",""TCP"",""1414"",""80  >  52748 [ACK] Seq=77436 Ack=438 Win=149 Len=1360 [TCP segment of a reassembled PDU]""";;;;;;;;;;;;;;;;;;;;;;;
"228,""3.001791"",""192.168.43.22"",""192.229.232.240"",""TCP"",""74"",""[TCP Dup ACK 216#6] 52748  >  80 [ACK] Seq=438 Ack=66556 Win=515 Len=0 SLE=70636 SRE=78796 SLE=67916 SRE=69276""";;;;;;;;;;;;;;;;;;;;;;;
"229,""3.002069"",""192.229.232.240"",""192.168.43.22"",""TCP"",""1414"",""[TCP Out-Of-Order] 80  >  52748 [ACK] Seq=69276 Ack=438 Win=149 Len=1360 [TCP segment of a reassembled PDU]""";;;;;;;;;;;;;;;;;;;;;;;
"230,""3.002109"",""192.168.43.22"",""192.229.232.240"",""TCP"",""66"",""[TCP Dup ACK 216#7] 52748  >  80 [ACK] Seq=438 Ack=66556 Win=515 Len=0 SLE=67916 SRE=78796""";;;;;;;;;;;;;;;;;;;;;;;
"231,""3.009532"",""192.229.232.240"",""192.168.43.22"",""HTTP"",""1414"",""[TCP Spurious Retransmission] Continuation""";;;;;;;;;;;;;;;;;;;;;;;
"232,""3.009593"",""192.168.43.22"",""192.229.232.240"",""TCP"",""66"",""[TCP Dup ACK 16#1] [TCP ACKed unseen segment] 52746  >  80 [ACK] Seq=1 Ack=9521 Win=515 Len=0 SLE=2721 SRE=4081""";;;;;;;;;;;;;;;;;;;;;;;
"233,""3.063722"",""192.229.232.240"",""192.168.43.22"",""TCP"",""1414"",""80  >  52748 [ACK] Seq=78796 Ack=438 Win=149 Len=1360 [TCP segment of a reassembled PDU]""";;;;;;;;;;;;;;;;;;;;;;;
"234,""3.063837"",""192.168.43.22"",""192.229.232.240"",""TCP"",""66"",""[TCP Dup ACK 216#8] 52748  >  80 [ACK] Seq=438 Ack=66556 Win=515 Len=0 SLE=67916 SRE=80156""";;;;;;;;;;;;;;;;;;;;;;;
